Symbol,Name,Last Sale,Net Change,% Change,Market Cap,Country,IPO Year,Volume,Sector,Industry
CL,Colgate-Palmolive Company Common Stock,$77.205,-0.375,-0.483%,65072133189.0,United States,,459121,Consumer Non-Durables,Package Goods/Cosmetics
AON,Aon plc Class A Ordinary Shares (Ireland),$294.95,-4.86,-1.621%,64987043150.0,United States,,148487,Finance,Specialty Insurers
FDX,FedEx Corporation Common Stock,$241.63,-5.72,-2.313%,64189023031.0,United States,,595630,Transportation,Air Freight/Delivery Services
COF,Capital One Financial Corporation Common Stock,$150.75,-1.2,-0.79%,64162525244.0,United States,1994.0,453601,Finance,Finance Companies
DXCM,DexCom Inc. Common Stock,$655.80,4.54,0.697%,63561469897.0,United States,2005.0,64314,Health Care,Medical Specialities
PBR,Petroleo Brasileiro S.A.- Petrobras Common Stock,$9.745,-0.295,-2.938%,63557870639.0,Brazil,,4379559,Energy,Oil & Gas Production
KLAC,KLA Corporation Common Stock,$418.835,-1.005,-0.239%,63504669478.0,United States,1980.0,273874,Capital Goods,Electronic Components
STLA,Stellantis N.V. Common Shares,$20.27,-0.02,-0.099%,63498180137.0,United Kingdom,2014.0,571176,Capital Goods,Auto Manufacturing
NIO,NIO Inc. American depositary shares each  representing one Class A ordinary share,$38.35,-1.32,-3.327%,62841604543.0,,2018.0,12756068,Finance,Finance Companies
UBS,UBS Group AG Registered Ordinary Shares,$17.955,-0.295,-1.616%,61865199116.0,Switzerland,2014.0,320725,Finance,Major Banks
CRWD,CrowdStrike Holdings Inc. Class A Common Stock,$268.4189,-1.3611,-0.505%,61251198896.0,United States,2019.0,663102,Technology,EDP Services
MRVL,Marvell Technology Inc. Common Stock,$74.35,0.71,0.964%,61236996523.0,Bermuda,2000.0,1255907,Technology,Semiconductors
